{
  "$schema": "./pre46-contract-revision-execution-receipt.schema.v0.1.json",
  "document_id": "DBA-TITMAS-PRE46-OFFLINE-CONTRACT-REVISION-EXECUTION-RECEIPT-0.1",
  "version": "0.1.0",
  "decision_reference": "CS-D02-PRE-46",
  "executed_at": "2026-07-27T05:01:41+08:00",
  "input_manifest_reference": "pre46-contract-revision-input-manifest.v0.1.json",
  "input_manifest_sha256": "99b86dcbd6a99865d832f44099ce9a4e3869733e38f79b6c7cb77eb6a6ada5b4",
  "plan_reference": "pre46-contract-revision-plan.v0.1.json",
  "plan_sha256": "7ef8a03c85ef607a4945d34660c91f0cfea7376cf591b07cca5cc87c3ca9288f",
  "result_reference": "pre46-contract-revision-result.v0.1.json",
  "result_sha256": "74cc1f337dc76b30de6db243df147b30a8078ad97f7acc819bc6b1a713538766",
  "report_reference": "PRE-46-COMPACT-SEQUENTIAL-AGENT-REVIEW-CONTRACT-REVISION-RESULT-v0.1.md",
  "report_sha256": "6a9ec57f4e4ea6fd154d0eae5a63701d75b43cbdf0598b55954f76118681ebba",
  "validation_counts": {
    "input_hashes_expected": 13,
    "input_hashes_matched": 13,
    "fixture_cases": 6,
    "fixture_cases_passed": 6,
    "network_requests": 0,
    "model_requests": 0,
    "credential_reads": 0
  },
  "result": "PASS_OFFLINE_CONTRACT_REVISION_PRE47_RECOMMENDATION_ALLOWED",
  "effects": {
    "pre44_gate_changed": false,
    "pre47_network_review_authorized": false,
    "rb1_implementation_authorized": false,
    "target_repository_modified": false,
    "release_authorized": false
  }
}
